path	sentence
clips\10952.mp3	楊祕書，妳已經跟著我多久了
clips\10953.mp3	記錯日期是很重要的事
clips\10954.mp3	做事又積極進取
clips\10955.mp3	今天演講稿還有出席的貴賓
clips\10956.mp3	素帆，妳要我查會員電話號碼
clips\10957.mp3	了解會員對公會的看法
clips\10958.mp3	那我我該怎麼問
clips\10959.mp3	就說你是理事張文學
clips\10960.mp3	需要我們幫忙嗎
clips\10961.mp3	你你對公會有什麼看法嗎
clips\10962.mp3	林溪水真愛跟我唱反調
clips\10963.mp3	不知道他在反對我什麼
clips\10964.mp3	讓家燕自然生就好了
clips\10965.mp3	親家他們想挑一個好時辰
clips\10966.mp3	你自己不是常找阿博師算命
clips\10967.mp3	嘴巴說跟開刀不一樣
clips\10968.mp3	為什麼要多割一刀讓肚子痛
clips\10969.mp3	好像少了一味什麼
clips\10970.mp3	我覺得好像少了團圓
clips\10971.mp3	以前人多隨便吃都好吃
clips\10972.mp3	好比中午剩我跟家龍在家沒菜
clips\10973.mp3	我們豬油拌飯、拌醬油
clips\10974.mp3	覺得很香又好吃了
clips\10975.mp3	現在 你跟家龍
clips\10976.mp3	用飯拌豬油、醬油很香又好吃
clips\10977.mp3	你不要嫌棄嘛
clips\10978.mp3	我是覺得今天沒胃口
clips\10979.mp3	你不用再擔心家龍跟淑惠了
clips\10980.mp3	他們很懂事、會打算
clips\10981.mp3	重點是我們兩個把身體照顧好
clips\10982.mp3	才可以認真奮鬥事業
clips\10983.mp3	現在台北物價怎麼這麼高
clips\10984.mp3	這幾年台北什麼都一直漲
clips\10985.mp3	你待在鄉下這麼久了
clips\10986.mp3	不會啊，我覺得鄉下比較好
clips\10987.mp3	怎麼樣，最近好嗎
clips\10988.mp3	因為工作很忙都沒打電話給你
clips\10989.mp3	爸，這陣子天氣比較冷
clips\10990.mp3	早晚多穿一點衣服
clips\10991.mp3	你在台北自己多注意點
clips\10992.mp3	現在台北天氣變冷了
clips\10993.mp3	自己該穿就要穿
clips\10994.mp3	子豪已經開始適應台北的生活
clips\10995.mp3	台北的工作做得順利嗎
clips\10996.mp3	還可以，慢慢適應了
clips\10997.mp3	自己要多注意
clips\10998.mp3	該穿暖和要穿得暖和
clips\10999.mp3	該做的我們再做，不要太累了
clips\11000.mp3	我看新聞常報導過勞死
clips\11001.mp3	我們不要用性命去賺錢
clips\11002.mp3	如果吃不慣台北的食物
clips\11003.mp3	只有吃飯的時候
clips\11004.mp3	你不在身邊永遠少了一味
clips\11005.mp3	剛才吃飯時我才告訴你阿姨
clips\11006.mp3	沒有你們在身邊一起吃飯
clips\11007.mp3	我也覺得好像少了一味什麼
clips\11008.mp3	我看你越講越愁眉苦臉
clips\11009.mp3	晚上不容易入眠
clips\11010.mp3	我帶淑惠、子豪回去看你們
clips\11011.mp3	有哦，好高興
clips\11012.mp3	你阿姨說很高興啦
clips\11013.mp3	好啦，我不跟你多說了
clips\11014.mp3	中午放飯時間只有一個小時
clips\11015.mp3	有空再打電話回來就好
clips\11016.mp3	明明想打電話給兒子
clips\11017.mp3	明明想孫子
clips\11018.mp3	要你不必這麼硬撐
clips\11019.mp3	這泡茶喝下去特別幸福
clips\11020.mp3	跟兒子講個電話而已
clips\11021.mp3	你這個歐吉桑
clips\11022.mp3	整個心情都好了起來
clips\11023.mp3	你現在打電話給誰
clips\11024.mp3	我跟雨傘公會的人說話
clips\11025.mp3	一個個打電話拜會才知道
clips\11026.mp3	原來有這麼多事情要處理
clips\11027.mp3	我過去真的太笨拙了
clips\11028.mp3	好，繼續保持
clips\11029.mp3	還會主動打電話關心會員
clips\11030.mp3	他上班沒幾天
clips\11031.mp3	現在懂得思考了
clips\11032.mp3	我覺得應該是虎頭蛇尾
clips\11033.mp3	阿霞，他有今天這種進步
clips\11034.mp3	添富，爸爸問你
clips\11035.mp3	是不是你教哥哥的
clips\11036.mp3	應該互相求進步才對
clips\11037.mp3	爸，我認為應該是素帆的關係
clips\11038.mp3	她對哥的影響真的很大
clips\11039.mp3	她做事謹慎、反應又快
clips\11040.mp3	在辦公室都會自己找事情做
clips\11041.mp3	好比她看到很多民眾找我陳情
clips\11042.mp3	想到幫我建立一個陳情檔案室
clips\11043.mp3	她真的是認真、負責
clips\11044.mp3	所以這件事一定是她教的
clips\11045.mp3	爸，當初你撮合素帆跟哥
clips\11046.mp3	爸爸有今天這個地位
clips\11047.mp3	每走一步棋都有所打算
clips\11048.mp3	現在看他們如何發展下去了
clips\11049.mp3	江素帆這個女孩很有自己想法
clips\11050.mp3	不可能接受文學
clips\11051.mp3	很多女孩子都很虛偽
clips\11052.mp3	別被她騙了
clips\11053.mp3	妳不要每次都瞧不起文學好嗎
clips\11054.mp3	認為沒有女孩喜歡他嗎
clips\11055.mp3	文學不錯，他很好啊
clips\11056.mp3	我們根本不知道她們在想什麼
clips\11057.mp3	如果江素帆反感呢
clips\11058.mp3	我覺得這件事不太可能
clips\11059.mp3	感情是慢慢培養
clips\11060.mp3	素帆會漸漸看到他的優點
clips\11061.mp3	只看兩人每天相處罷了
clips\11062.mp3	江素帆這個人還需要觀察
clips\11063.mp3	所有事情豈不全白費工夫嗎
clips\11064.mp3	已經從舞廳安排到辦公室
clips\11065.mp3	這件事不可以胡說，知道嗎
clips\11066.mp3	知道，我聽懂了
clips\11067.mp3	以後別說我不關心文學
clips\11068.mp3	每次關心都挨你罵
clips\11069.mp3	媽，妳誤會了
clips\11070.mp3	其實我覺得素帆是個好女孩
clips\11071.mp3	哥也真心喜歡她
clips\11072.mp3	阿霞，進去泡茶
clips\11073.mp3	我有事跟添富說
clips\11074.mp3	添富，金董事長公司的事
clips\11075.mp3	爸，我跟金董事長約好了
clips\11076.mp3	六點前要處理好這件事
clips\11077.mp3	正義，吃便當
clips\11078.mp3	何必跟豬賭氣，過來吃吧
clips\11079.mp3	別讓我找到天馬酒家的證據
clips\11080.mp3	一個女孩子，很漂亮哦
clips\11081.mp3	茼蒿送香菇給我做什麼
clips\11082.mp3	是不是你的愛慕者
clips\11083.mp3	與正氣凜然的態度所感動
clips\11084.mp3	怎麼可以亂收民眾送的禮物呢
clips\11085.mp3	糟了，會不會遇到暴露狂
clips\11086.mp3	暴露狂，你這個暴露狂 我不是暴露狂，我是王正義
clips\11087.mp3	茼蒿小姐，拜託妳好嗎
clips\11088.mp3	對了，代我向妳媽媽道謝
clips\11089.mp3	警察不可以收民眾的禮物
clips\11090.mp3	是不是送你香菇禮盒
clips\11091.mp3	我媽之前送他香菇禮盒
clips\11092.mp3	所以才專程還給我
clips\11093.mp3	我媽上次來台北遇到
clips\11094.mp3	妳媽從未送過我東西
clips\11095.mp3	他這兩天帶人抄酒店
clips\11096.mp3	不可能，我說話都很小心
clips\11097.mp3	不需要這樣懷疑她
clips\11098.mp3	對不起，是我說錯話了
clips\11099.mp3	無憑無據就胡亂懷疑
clips\11100.mp3	好，讓妳打
clips\11101.mp3	我今天跟老闆娘有點不愉快
clips\11102.mp3	對不起，不該扯到妳
clips\11103.mp3	今天又被老闆娘罵了嗎
clips\11104.mp3	反正這兩天我要交接了
clips\11105.mp3	以後不用再去那裡上班
clips\11106.mp3	妳也可以比較放心
clips\11107.mp3	這裡好冷，我們先進去
clips\11108.mp3	為了趕快讓妳當老闆娘
clips\11109.mp3	你沒回來我不安心
clips\11110.mp3	第一天上班就這麼晚嗎
clips\11111.mp3	離開職場這麼久
clips\11112.mp3	連公司制度也E化了
clips\11113.mp3	既然需要時間適應
clips\11114.mp3	所有業務要在規定時間內完成
clips\11115.mp3	沒關係，等慢慢上手就習慣了
clips\11116.mp3	別管我，妳妳先去睡吧
clips\11117.mp3	今天你就是經理了
clips\11118.mp3	不會像現在每天這麼累
clips\11119.mp3	你覺得很好笑嗎
clips\11120.mp3	現在我從一個特助開始做起
clips\11121.mp3	還得留在公司加班
clips\11122.mp3	我不是安慰妳
clips\11123.mp3	今天進公司我才知道
clips\11124.mp3	這幾年來此行業變化甚大
clips\11125.mp3	有些專業術語我根本聽不懂
clips\11126.mp3	我的程度根本無法帶人
clips\11127.mp3	看到你這麼累
clips\11128.mp3	我開始懷疑當初堅持來台北
clips\11129.mp3	究竟是對、是錯
clips\11130.mp3	拚出一番成績給爸爸看
clips\11131.mp3	心頭亂亂紛紛
clips\11132.mp3	時間就像這艘船
clips\11133.mp3	載我離開作夢的青春
clips\11134.mp3	但是看到你身心俱疲
clips\11135.mp3	我真的覺得很對不起你
clips\11136.mp3	有什麼對不起
clips\11137.mp3	有壓力才是進步的開始
clips\11138.mp3	相信我很快能跟上公司的腳步
clips\11139.mp3	我怕你心情調適不過來
clips\11140.mp3	之前你在公司職位這麼高
clips\11141.mp3	結果現在卻要從特助做起
clips\11142.mp3	當年妳離開台北的生活
clips\11143.mp3	跟著我去鄉下養豬
clips\11144.mp3	是否與我現在一樣
clips\11145.mp3	當年妳都可以犧牲自己
clips\11146.mp3	跟著我到鄉下適應養豬的生活
clips\11147.mp3	現在我也可以
clips\11148.mp3	慢慢從一個特助做起
clips\11149.mp3	以後妳要做好心理準備
clips\11150.mp3	我這個特助不知道要做多久
clips\11151.mp3	我擔心妳跟子豪會吃苦
clips\11152.mp3	我跟子豪都不覺得是吃苦
clips\11153.mp3	反而是你比較委屈
clips\11154.mp3	為了我跟子豪這麼辛苦
clips\11155.mp3	如同你之前所言
clips\11156.mp3	就會比較輕鬆 就會比較輕鬆
clips\11157.mp3	等會兒我來整理廚房就好了
clips\11158.mp3	明天一早妳還要送子豪去學校
clips\11159.mp3	你也要早點睡
clips\11160.mp3	等會兒還要完成它
clips\11161.mp3	你早點做完早點睡
clips\11162.mp3	現在要向大家報告的是
clips\11163.mp3	簡報的第一頁
clips\11164.mp3	現在要向大家報告的是
clips\11165.mp3	一個簡單的報告你弄那麼久
clips\11166.mp3	確定準備好再報告
clips\11167.mp3	現在最厲害的3D簡報
clips\11168.mp3	因為我會給你們三百六十度
clips\11169.mp3	全方位的精細、清楚
clips\11170.mp3	一目了然的互動式簡報
clips\11171.mp3	現在不只電影3D
clips\11172.mp3	連簡報也3D
clips\11173.mp3	我離開這幾年
clips\11174.mp3	你看，活魚賣成死魚了
clips\11175.mp3	最近生意怎麼跟之前差那麼多
clips\11176.mp3	真是一粒老鼠屎壞了一鍋粥
clips\11177.mp3	老闆，你的蛤蜊會縮水嗎
clips\11178.mp3	我家的蛤蜊會噴水不會縮水
clips\11179.mp3	我看光噴水就噴掉半斤了吧
clips\11180.mp3	當初買的時候你在這裡嗎
clips\11181.mp3	數字不會騙人
clips\11182.mp3	妳會上法院，我告訴妳
clips\11183.mp3	不要再作點心給我吃了
clips\11184.mp3	想先請妳嘗嘗好不好吃
clips\11185.mp3	我回去研究雨傘公會
clips\11186.mp3	我想開一個會員大會
clips\11187.mp3	這些點心要送他們吃的
clips\11188.mp3	那是藍苺乳酪
clips\11189.mp3	不是，我不敢吃辣
clips\11190.mp3	可以針對產品做討論
clips\11191.mp3	你都要盡全力幫忙
clips\11192.mp3	會員對你才有向心力，知道嗎
clips\11193.mp3	產品要做討論
clips\11194.mp3	議員，偷斤減兩的事
clips\11195.mp3	他直接在秤上動手腳
clips\11196.mp3	好，這兩天我過去看
clips\11197.mp3	阿水說的事是真的
clips\11198.mp3	有的在秤上動手腳
clips\11199.mp3	用針筒注水，增加重量
clips\11200.mp3	這些事是消費者知道的
clips\11201.mp3	還有很多消費者不知道的事
clips\11202.mp3	魚市場的生意跟以前不能比了
clips\11203.mp3	消費者吃虧的事都傳出去了
clips\11204.mp3	議員，如果你願意幫忙
clips\11205.mp3	好，我知道了
clips\11206.mp3	剛才你們說勇哥很耳熟
clips\11207.mp3	每次選舉都來幫忙的勇哥
clips\11208.mp3	所以勇哥是你的樁腳
clips\11209.mp3	這件事我會視情況處理
clips\11210.mp3	我們未來的夢都在這裡
clips\11211.mp3	你要在這裡開店嗎
clips\11212.mp3	雖然這裡沒有獨立店面
clips\11213.mp3	但人潮很多，你看
clips\11214.mp3	人家說人潮就是錢潮
clips\11215.mp3	我想什麼妳都知道
clips\11216.mp3	從這裡開始打出知名度
clips\11217.mp3	等賺了錢再出去開餐廳
clips\11218.mp3	惠如，妳知道嗎
clips\11219.mp3	都是從夜市起家的
clips\11220.mp3	但英雄不怕出身低
clips\11221.mp3	不管我們的餐廳開在哪裡
clips\11222.mp3	客人才會口耳相傳
clips\11223.mp3	但台北人吃東西都是吃氣氛
clips\11224.mp3	所以我打算租下這裡
clips\11225.mp3	而且要走高級的質感路線
clips\11226.mp3	一定要是帥哥、美女
clips\11227.mp3	家昌，來美食街的人
clips\11228.mp3	他們反而不敢進來
clips\11229.mp3	是平實的價格、高級的享受
clips\11230.mp3	但開餐廳最重要是料理好吃
clips\11231.mp3	我作的料理需要懷疑嗎
clips\11232.mp3	一定會賣得嗄嗄叫
clips\11233.mp3	而且這裡這麼寬敞
clips\11234.mp3	雖然在美食街裡面
clips\11235.mp3	我覺得雖然有獨立的空間
clips\11236.mp3	但似乎把美食街的人潮隔開了
clips\11237.mp3	那是因為我還沒來開店
clips\11238.mp3	人潮就會往這邊來了
clips\11239.mp3	但店面這麼大
clips\11240.mp3	我一開始也擔心店租肯定很貴
clips\11241.mp3	但想不到店租很便宜
clips\11242.mp3	願意算我便宜一點
clips\11243.mp3	不租出去是因為在等我
clips\11244.mp3	機會不是說來就來
clips\11245.mp3	我已經等很久了
clips\11246.mp3	這次一定要好好把握機會
clips\11247.mp3	不能讓別人看不起我
clips\11248.mp3	明天早自習要考英文
clips\11249.mp3	爸爸今天幾點下班啊
clips\11250.mp3	爸爸好幾天都沒有回來了
clips\11251.mp3	我可以等他回來再去睡嗎
clips\11252.mp3	我們搬上台北之後都很忙
clips\11253.mp3	子豪反而變得比較懂事了
clips\11254.mp3	子豪才懂得珍惜
clips\11255.mp3	他知道你賺錢很辛苦
clips\11256.mp3	所以讀書很認真
clips\11257.mp3	子豪這麼認真學習
clips\11258.mp3	我這個爸爸也不可以輸他
clips\11259.mp3	你已經很努力了
clips\11260.mp3	對了，昨晚做簡報到這麼晚
clips\11261.mp3	今天在公司順利嗎
clips\11262.mp3	可能我離開職場太久了
clips\11263.mp3	今天在會議室報告不是很順利
clips\11264.mp3	怎麼會這樣
clips\11265.mp3	今天在會議上
clips\11266.mp3	我第一次聽到3D簡報
clips\11267.mp3	妳也不曾聽過嗎
clips\11268.mp3	你不會怎麼辦
clips\11269.mp3	如果學不來就別勉強了
clips\11270.mp3	我看乾脆找你比較熟的工作
clips\11271.mp3	不希望你壓力這麼大
clips\11272.mp3	我已經找了幾間學校、補習班
clips\11273.mp3	我想趕快賺錢補貼家用
clips\11274.mp3	不能讓你一個人這麼辛苦
clips\11275.mp3	淑惠，我們剛搬到台北
clips\11276.mp3	現在子豪對這個環境還不熟悉
clips\11277.mp3	他每天要上課、上補習班
clips\11278.mp3	如果妳去上班誰接送
clips\11279.mp3	這些我已經考慮過了
clips\11280.mp3	我一定會把時間安排好
clips\11281.mp3	不管在南部還是台北
clips\11282.mp3	把家裡所有工作都做好
clips\11283.mp3	讓我能夠專心在職場奮鬥
clips\11284.mp3	淑惠，辛苦妳了
clips\11285.mp3	妳知道魚市場陳情的那件事
clips\11286.mp3	還有什麼事需要我做嗎
clips\11287.mp3	議員，我想請問魚市場陳情案
clips\11288.mp3	一個小小助理這麼多意見
clips\11289.mp3	怎麼，現在妳才是老闆
clips\11290.mp3	要妳教議員如何處理事情嗎
clips\11291.mp3	對不起，我真的沒那個意思
clips\11292.mp3	因為我從小在魚市場長大
clips\11293.mp3	裡面人事物我都很熟
clips\11294.mp3	我想如果議員需要幫忙 阿姨
clips\11295.mp3	好了，你們先去忙自己的事
clips\11296.mp3	等我把事情處理完
clips\11297.mp3	我會去處理魚市這件事好嗎
clips\11298.mp3	魚市場究竟發生什麼事
clips\11299.mp3	阿勇做生意不老實欺騙消費者
clips\11300.mp3	我們選舉真的有事的時候
clips\11301.mp3	都是勇哥出面幫我們處理的
clips\11302.mp3	所以現在在想該怎麼做才好
clips\11303.mp3	像這種事當然還是別管
clips\11304.mp3	這種事放著就好了
clips\11305.mp3	一定會處理魚市的事好嗎
clips\11306.mp3	素帆，妳有沒有怎麼樣
clips\11307.mp3	我只是不捨從小長大的地方
clips\11308.mp3	還有很多人要靠魚市場生活
clips\11309.mp3	心動不如馬上行動啊
clips\11310.mp3	我看妳一定有很多想法
clips\11311.mp3	其實我想到一個辦法
clips\11312.mp3	能夠有個公正的保障
clips\11313.mp3	能夠定期來為公秤做把關
clips\11314.mp3	那公秤呢也不是強迫性質
clips\11315.mp3	所以我們就先把公秤設在這裡
clips\11316.mp3	這樣對消費者比較有保障
clips\11317.mp3	表示張議員聽到民眾的心聲了
clips\11318.mp3	其實這個辦法是素帆想的
clips\11319.mp3	她提議我弟弟很贊成
clips\11320.mp3	看看反應如何再做決定
clips\11321.mp3	如果大家沒意見
clips\11322.mp3	沒關係，有事我負責
clips\11323.mp3	如果被議員的樁腳知道了
clips\11324.mp3	做什麼你都看到了，還問我
clips\11325.mp3	不是，我是說妳現在會很忙嗎
clips\11326.mp3	妳那邊會很冷嗎
clips\11327.mp3	這裡有張聲明書
clips\11328.mp3	當兄弟姐妹面前簽名
clips\11329.mp3	彷彿要我跟家人斷絕關係
clips\11330.mp3	家燕嫁出去經常回來
clips\11331.mp3	你不是一天到晚想見家燕
clips\11332.mp3	我不要她多事回來管家裡的事
clips\11333.mp3	隨便啦，她方便就好
clips\11334.mp3	你回來怎麼不先說一聲呢
clips\11335.mp3	爸，你不要我回來嗎
clips\11336.mp3	剛才說的是你大嫂
clips\11337.mp3	媽，現在都是妳煮飯嗎
clips\11338.mp3	不然你也可以去煮啊
clips\11339.mp3	不用，我閒來無事多少動一動
clips\11340.mp3	我看妳是勞神傷身
clips\11341.mp3	為人媳不可以在背後批評婆婆
clips\11342.mp3	家燕，妳要家昌回來
clips\11343.mp3	妳要說什麼，快告訴他
clips\11344.mp3	哥，我現在在外面工作
clips\11345.mp3	很感謝你這麼支持我
clips\11346.mp3	應該分擔就分擔
clips\11347.mp3	阿姨，既然家昌回來了
clips\11348.mp3	萬一有糾紛反而傷了感情
clips\11349.mp3	勸妳跟家龍不要去台北
clips\11350.mp3	爸，真抱歉
clips\11351.mp3	像之前她把土地過戶給家龍
clips\11352.mp3	說要給家昌開餐廳
clips\11353.mp3	所以現在我當然也不能確定
clips\11354.mp3	阿姨究竟勸我跟家龍不去台北
clips\11355.mp3	你是老實人，不一定聽得懂
clips\11356.mp3	大嫂，我聽得懂妳那些話
clips\11357.mp3	不要什麼事推到我媽頭上好嗎
clips\11358.mp3	我婆婆要惠如去上海工作
clips\11359.mp3	你打算去被挖苦還是丟臉
clips\11360.mp3	如果不怕她媽媽唾棄你
clips\11361.mp3	先被你念得抬不起頭了
clips\11362.mp3	好像有人保護
clips\11363.mp3	我就不怕被騙或被欺負了對吧
clips\11364.mp3	好人，我是好人
clips\11365.mp3	添富，我想通了
clips\11366.mp3	表示她已經發好人卡給我了
clips\11367.mp3	她把我當成好人，不是好朋友
clips\11368.mp3	是我自己太傻沒想通
clips\11369.mp3	才會還沒開始談戀愛就失戀了
clips\11370.mp3	其實世上有這麼多女孩子
clips\11371.mp3	你只不過被其中一個拒絕
clips\11372.mp3	心裡一樣會受傷
clips\11373.mp3	我相信你今天只要走出大門
clips\11374.mp3	一定會遇到更多、更好的選擇
clips\11375.mp3	我不要其他的選擇
clips\11376.mp3	今天我有個朋友開生日派對
clips\11377.mp3	我才剛失戀還在療傷
clips\11378.mp3	我們一起去好嗎
clips\11379.mp3	我有個朋友過生日在這裡包場
clips\11380.mp3	早知道不來這個派對了
clips\11381.mp3	芳姿，如果妳對他印象不好
clips\11382.mp3	不需要因為他得罪妳朋友
clips\11383.mp3	我把他當成隱形人就好了
clips\11384.mp3	壽星堅持議員到場幫他開舞
clips\11385.mp3	等等，我又不會跳舞
clips\11386.mp3	我會緊張啦，想去廁所
clips\11387.mp3	好，但你要答應我不能開溜哦
clips\11388.mp3	議員，這個我來處理
clips\11389.mp3	摔倒，從樓梯上面滾下來
clips\11390.mp3	小姐，妳顧顧形象
clips\11391.mp3	張議員來到現場
clips\11392.mp3	請假應該我自己去才對
clips\11393.mp3	芳姿，這麼騙人好嗎
clips\11394.mp3	妳怎麼在這裡上班呢
clips\11395.mp3	我聽人家說舞廳很複雜耶
clips\11396.mp3	其實她的工作本來很單純
clips\11397.mp3	但你出現之後就變複雜了
clips\11398.mp3	因為她不想因為你被人誤會
clips\11399.mp3	上次我阿姨說話是過分了點
clips\11400.mp3	芳姿，妳不需要這樣啦
clips\11401.mp3	反正今天他不是專程來找我
clips\11402.mp3	對啊，我跟弟弟來參加派對
clips\11403.mp3	怎麼知道素帆在這裡工作
clips\11404.mp3	跟弟弟來參加派對啊
clips\11405.mp3	你會跳舞嗎
clips\11406.mp3	我我當然會啊
clips\11407.mp3	那個我正好還沒學到
clips\11408.mp3	我學過阿魯巴啊
clips\11409.mp3	是吉魯巴，不是阿魯巴啦
clips\11410.mp3	吉魯巴跟阿魯巴都分不清楚
clips\11411.mp3	張添財，你真土耶
clips\11412.mp3	妳看，素帆跟別人不一樣
clips\11413.mp3	知道誰對她真心
clips\11414.mp3	有信心她會喜歡我
clips\11415.mp3	我拜託你去撒泡尿照照鏡子
clips\11416.mp3	人矮腿短、一副呆樣
clips\11417.mp3	因為你高攀不起
clips\11418.mp3	我所言屬實，為什麼要道歉
clips\11419.mp3	這是我的事自己處理
clips\11420.mp3	哥，不能夠這樣讓她侮辱
clips\11421.mp3	我現在找律師告她
clips\11422.mp3	張先生，芳姿說話比較難聽
clips\11423.mp3	我在此向你道歉
clips\11424.mp3	添富，我沒心情參加派對了
clips\11425.mp3	芳姿，知道妳想保護我
clips\11426.mp3	不過剛才對張先生說的話
clips\11427.mp3	是過分了點
clips\11428.mp3	他會放棄妳嗎
clips\11429.mp3	又因為他被誤會、受委屈
clips\11430.mp3	被他家人蹧蹋
clips\11431.mp3	好啦，我知道了
clips\11432.mp3	小朋友，比賽開始
clips\11433.mp3	我們現在要宣布今天的成績
clips\11434.mp3	林政峰小朋友，三十七分
clips\11435.mp3	他的分數是四十二分
clips\11436.mp3	好，恭喜這三位小朋友
clips\11437.mp3	張老師，恭喜
clips\11438.mp3	國中你可以讀科學資優班
clips\11439.mp3	張立委，上次拜託你的事
clips\11440.mp3	對立委而言應該很容易才對啊
clips\11441.mp3	越小的事，真的越難辦
clips\11442.mp3	但是總有老師要退休啊
clips\11443.mp3	妳在這裡教書教得好好的
clips\11444.mp3	我先生要到台北當經理
clips\11445.mp3	我先生之前是電子公司主管
clips\11446.mp3	這陣子人家請他回公司上班
clips\11447.mp3	都要設法請調台北任教
clips\11448.mp3	否則我們夫妻分隔兩地
clips\11449.mp3	台北老師職缺很少沒錯
clips\11450.mp3	但是你人脈這麼廣
clips\11451.mp3	應該很多人會看你面子才對
clips\11452.mp3	立委真的很想幫忙
clips\11453.mp3	妳為了請調台北任教一事
clips\11454.mp3	跟公婆鬧得很不愉快
clips\11455.mp3	如果立委真的幫妳請調台北
clips\11456.mp3	妳公婆責怪立委
clips\11457.mp3	沒有，公婆只是關心我的工作
clips\11458.mp3	夫人，妳聽誰說的啊
clips\11459.mp3	妳問誰說的我怎麼回答呢
clips\11460.mp3	俗話說無風不起浪
clips\11461.mp3	既然這些話已經傳到這裡
clips\11462.mp3	我們當然不能自作主張
clips\11463.mp3	我跟立委到家裡拜訪妳公婆
clips\11464.mp3	問問他們對於妳請調台北一事
clips\11465.mp3	我馬上要立委幫妳發落這件事
clips\11466.mp3	如此麻煩你們就不必了
clips\11467.mp3	不好意思，我先回去了
clips\11468.mp3	阿霞，我問妳
clips\11469.mp3	妳怎麼這麼了解他們家的事
clips\11470.mp3	比賽拿冠軍
clips\11471.mp3	子豪以後肯定跟爸爸一樣厲害
clips\11472.mp3	家龍，台北有間私立國中
clips\11473.mp3	子豪，先上樓寫功課
clips\11474.mp3	阿姨，妳怎麼突然這麼問
clips\11475.mp3	如果台北沒有職缺
clips\11476.mp3	阿姨，妳的意思是
clips\11477.mp3	如果沒找到職缺
clips\11478.mp3	沒有，妳阿姨的意思是
clips\11479.mp3	尚未找到教師職缺就別去台北
clips\11480.mp3	爸，我找到教師職缺了
clips\11481.mp3	淑惠，找到台北學校教師職缺
clips\11482.mp3	一樣都是教師工作
clips\11483.mp3	夫妻不先商量就說去台北
clips\11484.mp3	申請台北哪間學校任教
clips\11485.mp3	爸，你問這個做什麼
clips\11486.mp3	問妳在哪間學校任教
clips\11487.mp3	爸，這些我自然會安排好
clips\11488.mp3	你們想到就問
clips\11489.mp3	我怎麼應付你們這麼多問題呢
clips\11490.mp3	問了還不高興
clips\11491.mp3	能夠自己處理就好
clips\11492.mp3	事情尚未安排妥當
clips\11493.mp3	台北房價昂貴，買不起
clips\11494.mp3	人矮腿短、一副呆樣
clips\11495.mp3	為什麼我的感情被拒絕
clips\11496.mp3	這是我的名字和生辰八字
clips\11497.mp3	果然不出我所料
clips\11498.mp3	手掌心發白光
clips\11499.mp3	有一道白氣衝上印堂
clips\11500.mp3	是大旺之相
clips\11501.mp3	這是照妖，不是照人
clips\11502.mp3	師父，這不是白光
clips\11503.mp3	剛才我在外面被腳踏車撞到
clips\11504.mp3	師師父，連這個都看錯
clips\11505.mp3	懷疑我說得不準嗎
clips\11506.mp3	回去繼續接受命運的折磨
clips\11507.mp3	信之則有，不信則無
clips\11508.mp3	這個讓你待會兒向我道歉
clips\11509.mp3	所以如果我待會兒算得準
clips\11510.mp3	這包要大一點才有誠意
clips\11511.mp3	陰差陽錯日
clips\11512.mp3	你的感情應該都不順遂吧
